{
  "id": "gothic",
  "name": "Gothic",
  "description": "Tall vertical proportions and dark stone surfaces broken by pointed arches, ribbed vaults and tall narrow windows fitted with coloured stained glass. Evokes the cathedrals, chapter houses and fortified abbeys of medieval Europe.",
  "palette": {
    "primary": [
      "minecraft:stone_bricks",
      "minecraft:dark_oak_planks"
    ],
    "secondary": [
      "minecraft:cobblestone"
    ],
    "accent": [
      "minecraft:chiseled_stone_bricks",
      "minecraft:polished_andesite"
    ],
    "roof": [
      "minecraft:smooth_stone_slab",
      "minecraft:andesite_slab"
    ],
    "floor": [
      "minecraft:polished_andesite"
    ],
    "glass": [
      "minecraft:red_stained_glass_pane",
      "minecraft:purple_stained_glass_pane",
      "minecraft:blue_stained_glass_pane"
    ],
    "light": [
      "minecraft:lantern",
      "minecraft:soul_lantern"
    ]
  },
  "signature_elements": [
    "pointed arches",
    "ribbed vaults",
    "stained glass rosettes",
    "tall narrow windows",
    "flying buttresses (column proxies)",
    "dark stone surfaces"
  ],
  "ratios": {
    "story_height": 6,
    "wall_thickness": 2,
    "window_width": 2,
    "roof_pitch": 1.5
  },
  "alexander_patterns": [
    "light-on-two-sides",
    "strong-centers",
    "sheltering-roof"
  ]
}
